{"run": 18, "commit": "ac968eb", "metric": 22.794, "samples": [22.864, 24.388, 22.794, 22.663, 22.715], "metrics": {"grounder_atoms": 47644479, "grounder_pushes": 22398404, "peak_mem_mb": 51}, "ab": {"head_commit": "ac968eb", "head_median": 22.846, "head_samples": [22.848, 22.799, 22.857, 22.675, 22.846]}, "confidence": 0.60, "improvement_rel": 0.0023, "win_kind": "cheaper", "status": "discard", "description": "Remove a redundant temporary in DatalogAtom's ctor: arguments(Arguments(std::move(arguments))) -> arguments(std::move(arguments)) (two inline-Arguments moves -> one), on every Fact construction (~47.6M). Byte-identical (counters FLAT). DISCARD: A/B (noisy window, load just spiked to 2.29) gives 0.23%, confidence 0.60x = within noise. The inline small_vector<Term,4> move is a ~32-byte memcpy; removing one per Fact is ~0.7% theoretical max and didn't clear noise. Strictly-better code but not a measurable metric win, so reverted per the time-gate. (A future cleanup could take it for code quality.)", "timestamp": 1782795614, "segment": 0}
{"run": "checkpoint2", "commit": "ac968eb", "metric": 22.705, "samples": [23.221, 22.620, 22.806, 22.705, 22.630], "metrics": {"grounder_atoms": 47644479, "grounder_pushes": 22398404, "peak_mem_mb": 51}, "ab": {"baseline_commit": "f2ff317", "baseline_median": 53.301, "baseline_samples": [53.012, 54.834, 53.102, 53.301, 53.426]}, "improvement_rel": 0.574, "win_kind": "cheaper", "status": "verification", "description": "CUMULATIVE CHECKPOINT after 11 keeps (runs 2-5,8,9,13-17). Contemporaneous A/B of current HEAD ac968eb vs ORIGINAL baseline f2ff317: baseline median 53.301s -> current 22.705s = 57.4% faster (2.35x speedup). grounder_atoms/pushes IDENTICAL to baseline (47644479/22398404) => every kept change behaviour-preserving. peak_mem 68->51MB. Two waves: (1) remove per-fact heap allocs (inline small_vectors) + skip per-call hash rehashing (reserve/reuse); (2) after that unmasked them, fix slow data structures (std::unordered_map->flat_hash_map for head positions = 10%), accidental work (operator[] empty-entry pollution), redundant per-element lookups (precompute head positions), and a by-value table return. Logged for the record.", "timestamp": 1782796369, "segment": 0}
{"run": 19, "commit": "4765b0c", "metric": 22.217, "samples": [22.310, 22.409, 22.217, 22.208, 22.145], "metrics": {"grounder_atoms": 47644479, "grounder_pushes": 22398404, "peak_mem_mb": 51}, "ab": {"head_commit": "ac968eb", "head_median": 22.654, "head_samples": [22.800, 22.711, 22.621, 22.654, 22.614]}, "confidence": 6.08, "improvement_rel": 0.0193, "win_kind": "cheaper", "status": "keep", "description": "The grounder's per-popped-fact dispatch called the VIRTUAL RuleBase::get_type() up to twice per matched rule (once per PROJECT/JOIN branch test) -- tens of millions of vtable indirections. Cache the rule type in the Match struct (filled once when the RuleMatcher is built, via a single get_type() per rule) and dispatch on m.get_type() (a plain int field). Byte-identical -> grounder_atoms/pushes FLAT, 62/62 checks pass. Win is 'cheaper'. Contemporaneous A/B vs fresh HEAD ac968eb (22.654 median): KEEP, confidence 6.08x, 1.9%. (A first cut that just read get_type() once was ~0.65% / RERUN-marginal; eliminating the virtual call entirely was ~3x better.)", "timestamp": 1782797554, "segment": 0}
