{"type": "config", "name": "powerlifted-htg-grounder-work", "metricName": "search_time", "metricUnit": "s", "bestDirection": "lower", "secondaryMetrics": ["grounder_atoms", "grounder_pushes", "peak_mem_mb"], "gate": "relaxed: every baseline-solved pair still solves with plan cost <= baseline; trajectory not gated", "note": "deterministic grounder_atoms is a SCREEN, not a gate: 'cheaper-per-fact' wins leave it flat while cutting time"}
{"run": 1, "commit": "f2ff317", "metric": 50.944, "samples": [51.292, 50.824, 50.678, 51.552, 50.944], "metrics": {"grounder_atoms": 47644479, "grounder_pushes": 22398404, "peak_mem_mb": 68}, "derived": {"wasted_productions": 25246075, "wasted_pct": 53.0}, "confidence": null, "status": "keep", "description": "baseline: master HEAD + grounder meter (identical code to greedy-join baseline); current Fast-Downward grounder; 5 sweeps via REPS=5 ./autoresearch.sh (gate passed all 5). grounder_atoms identical on every sweep (deterministic).", "timestamp": 1782779703, "segment": 0}
{"run": 2, "commit": "cf27d27", "metric": 49.864, "samples": [49.864, 49.739, 54.095, 49.619, 50.128], "metrics": {"grounder_atoms": 47644479, "grounder_pushes": 22398404, "peak_mem_mb": 64}, "ab": {"head_median": 52.976, "head_samples": [52.976, 53.009, 52.635, 53.293, 52.759]}, "confidence": 9.087, "improvement_rel": 0.0587, "win_kind": "cheaper", "status": "keep", "description": "Defer achiever construction: probe reached_facts with the achiever-free head, build the Achievers vector ONLY on the new-fact branch (cheaper-path keeps and discards never read an achiever -- backchaining reads achievers from lp, written once at first insertion; reached_facts achievers are dead). Moved the cheapest-path check inline into project/join/product (removed the batch newfacts buffer), move-insert kept facts into reached_facts. grounder_atoms/pushes FLAT vs baseline (identical productions => behavior-preserving; 62/62 checks pass). Win is 'cheaper' not 'fewer'. Contemporaneous A/B vs fresh HEAD (52.976 median): KEEP, confidence 9.09x, 5.87%. peak_mem 68->64MB.", "timestamp": 1782781681, "segment": 0}
{"run": 3, "commit": "fe9b548", "metric": 39.673, "samples": [40.010, 39.521, 39.611, 39.673, 40.097], "metrics": {"grounder_atoms": 47644479, "grounder_pushes": 22398404, "peak_mem_mb": 64}, "ab": {"head_commit": "cf27d27", "head_median": 49.697, "head_samples": [49.646, 49.733, 49.697, 49.652, 49.753]}, "confidence": 126.38, "improvement_rel": 0.2017, "win_kind": "cheaper", "status": "keep", "description": "Vendor utils/small_vector.h (inline-buffer vector for trivially-copyable T) and back datalog::Arguments with small_vector<Term,4> instead of std::vector<Term>. Typical atom arities (genome-edit-distance, the dominant ~59% domain, has arity <=2) now keep their argument terms inline, removing the per-produced-fact heap allocation (~47.6M Arguments copies in join/project/product). small_vector operator== is element-wise via Term::operator== and iterators are raw Term*, so Fact hashing/equality is byte-for-byte identical -> grounder_atoms/pushes FLAT (deterministic counters unchanged; behavior preserved; 62/62 checks pass). Fixed join.h JoiningVariables to qualify std::find/std::distance (raw-pointer iterators kill the prior std ADL). Win is 'cheaper'. Contemporaneous A/B vs fresh HEAD cf27d27 (49.697 median): KEEP, confidence 126x, 20.2%. Note: an earlier 65s single-sweep reading was contaminated by leftover background perf+search processes (env blocks perf sampling: 0 samples); killed them, load settled, re-measured clean.", "timestamp": 1782783737, "segment": 0}
{"run": 4, "commit": "924e16e", "metric": 33.122, "samples": [33.122, 33.289, 33.123, 33.087, 33.115], "metrics": {"grounder_atoms": 47644479, "grounder_pushes": 22398404, "peak_mem_mb": 55}, "ab": {"head_commit": "fe9b548", "head_median": 39.588, "head_samples": [39.445, 39.454, 39.588, 39.909, 39.660]}, "confidence": 81.52, "improvement_rel": 0.1633, "win_kind": "cheaper", "status": "keep", "description": "Back datalog::Achievers with utils::small_vector<int,2> instead of std::vector<int>, and add direct int(a) and int(a,b) constructors so the hot project (1-atom body) and join (2-atom body) achiever bodies are built inline with NO heap allocation -- previously each newly reached fact (~22.4M) allocated a 1-2 element int vector. Product rules (body >2) keep a std::vector-range constructor and spill transparently. Achievers are not part of Fact hash/equality, so grounder_atoms/pushes stay FLAT (deterministic; behavior preserved; 62/62 checks pass; plan costs unchanged). Win is 'cheaper'. Contemporaneous A/B vs fresh HEAD fe9b548 (39.588 median): KEEP, confidence 81.5x, 16.3%. peak_mem 64->55MB.", "timestamp": 1782784496, "segment": 0}
{"run": 5, "commit": "f8ede57", "metric": 29.564, "samples": [29.704, 29.564, 29.488, 29.529, 29.630], "metrics": {"grounder_atoms": 47644479, "grounder_pushes": 22398404, "peak_mem_mb": 55}, "ab": {"head_commit": "924e16e", "head_median": 32.878, "head_samples": [32.849, 32.878, 32.789, 33.502, 33.061]}, "confidence": 31.48, "improvement_rel": 0.1008, "win_kind": "cheaper", "status": "keep", "description": "Change JoinHashKey from std::vector<int> to utils::small_vector<int,3>; the key is rebuilt once per (popped fact, matching join rule) and joins share few vars (genome-edit-distance joins on <=2), so it now stays inline (no heap) both as the per-firing probe key and as the stored map key. Added a local JoinHashKeyHash (utils::hash_range, identical hash values to the prior VectorHash<int>) since utils::VectorHash is hard-typed to std::vector; added small_vector::reserve. hash/eq identical -> grounder_atoms/pushes FLAT (behavior preserved; 62/62 checks pass). Win is 'cheaper'. Contemporaneous A/B vs fresh HEAD 924e16e (32.878 median): KEEP, confidence 31.5x, 10.1%.", "timestamp": 1782785223, "segment": 0}
{"run": 6, "commit": "f8ede57", "metric": 29.680, "samples": [29.680, 29.738, 29.613, 29.988, 29.491], "metrics": {"grounder_atoms": 47644479, "grounder_pushes": 22398404, "peak_mem_mb": 55}, "ab": {"head_commit": "f8ede57", "head_median": 29.369, "head_samples": [29.446, 29.355, 29.887, 29.280, 29.369]}, "confidence": 2.913, "improvement_rel": -0.0106, "win_kind": "cheaper", "status": "discard", "description": "Idea #3: replace the cheaper-path erase+insert in process_new_fact with an in-place cost mutation (const_cast<Fact&>(*it).set_cost; cost is not part of the Fact key, so the set stays valid). Counters FLAT (behavior preserved). But DISCARD: contemporaneous A/B vs HEAD f8ede57 (29.369 median) gave candidate 29.680 median = -1.1% (slightly worse, within noise, confidence 2.9x but wrong direction). The strictly-cheaper-path branch is too infrequent (most of the 22.4M pushes are first-reaches, not cost improvements) for removing its erase+insert to register. Reverted.", "timestamp": 1782785816, "segment": 0}
{"run": 7, "commit": "f8ede57", "metric": 29.436, "samples": [29.327, 29.332, 29.408, 29.438, 29.719, 29.585, 29.490, 29.434, 29.492, 29.382], "metrics": {"grounder_atoms": 47644479, "grounder_pushes": 22398404, "peak_mem_mb": 48}, "ab": {"head_commit": "f8ede57", "head_median": 29.5305, "head_samples": [29.529, 29.476, 30.436, 30.061, 29.724, 29.436, 29.504, 29.427, 29.549, 29.532]}, "confidence": 1.154, "improvement_rel": 0.0032, "win_kind": "cheaper", "status": "discard", "description": "Rewrite utils::small_vector with a union-based SBO layout (inline buffer unioned with heap pointer; capacity_ discriminates inline vs heap), removing the redundant 8-byte data_ pointer. Shrinks every Fact ~16 bytes (Arguments 32->24, Achievers 24->16). Counters FLAT (rewrite correct; behavior preserved). DETERMINISTIC memory win: peak_mem 55->48MB (-13%). But DISCARD on the PRIMARY metric: pooled 10+10 A/B vs HEAD f8ede57 gives only 0.32% (below 1.11% noise floor), confidence 1.15x and FALLING as reps grow -> no confirmable time win. INSIGHT: reached_facts is local to each ground() call and cleared per state eval, so each set is small/cache-resident regardless of Fact size; the runs 3-5 wins came from removing ALLOCATIONS (malloc/free cost), not object size. => size/N-tuning is a dead end here; future wins must remove allocations or cut operation count (the 'fewer'/productions lever). Reverted (kept the simpler pointer-based small_vector).", "timestamp": 1782786831, "segment": 0}
{"run": 8, "commit": "3377ad4", "metric": 28.095, "samples": [28.095, 27.967, 28.033, 28.219, 28.158], "metrics": {"grounder_atoms": 47644479, "grounder_pushes": 22398404, "peak_mem_mb": 55}, "ab": {"head_commit": "f8ede57", "head_median": 29.822, "head_samples": [29.750, 30.086, 29.915, 29.822, 29.655]}, "confidence": 14.12, "improvement_rel": 0.0579, "win_kind": "cheaper", "status": "keep", "description": "Reserve the grounder's local reached_facts (phmap::flat_hash_set<Fact>) up front to the previous ground() call's final size, instead of growing it from empty every call. The grounder is re-run once per state on similar reachable sets, so this skips the ~log(n) doubling rehashes (each rehashing all current elements) that the set otherwise pays per call -- targets allocation/rehash COUNT (the confirmed lever from run 7's insight), not object size. Added member reached_size_hint, set from reached_facts.size() at both return points. reached_facts is only probed by key / never iterated for productions, so capacity is behaviour-neutral -> grounder_atoms/pushes FLAT (62/62 checks pass). Win is 'cheaper'. Contemporaneous A/B vs fresh HEAD f8ede57 (29.822 median): KEEP, confidence 14.1x, 5.8%.", "timestamp": 1782787538, "segment": 0}
{"run": 9, "commit": "221da57", "metric": 26.668, "samples": [27.047, 26.472, 26.668, 26.531, 26.754], "metrics": {"grounder_atoms": 47644479, "grounder_pushes": 22398404, "peak_mem_mb": 55}, "ab": {"head_commit": "3377ad4", "head_median": 27.910, "head_samples": [28.011, 27.850, 27.906, 28.592, 27.910]}, "confidence": 8.96, "improvement_rel": 0.0445, "win_kind": "cheaper", "status": "keep", "description": "Stop destroying+rebuilding each JoinRule's hash tables every ground() call. JoinRule::clean_up was 'hash_table_indices = JoinHashTable()' (frees both phmap maps); now it calls reset_for_next_call() which records the previous call's key counts, clears the two outer maps in place, and reserves them to those counts. Same proven reserve pattern as run 8 (reached_facts) applied to the join hash outer maps -> skips the doubling rehashes the maps pay refilling from empty per call. Tables end up empty+pre-sized, functionally identical to fresh -> grounder_atoms/pushes FLAT (62/62 checks pass). (Inner per-key sets are still rebuilt; only the outer maps are reused.) Win is 'cheaper'. Contemporaneous A/B vs fresh HEAD 3377ad4 (27.910 median): KEEP, confidence 9.0x, 4.5%.", "timestamp": 1782788837, "segment": 0}
{"run": 10, "commit": "221da57", "metric": null, "samples": [], "metrics": {"grounder_atoms": 47644479, "grounder_pushes": 22398404, "peak_mem_mb": 55}, "confidence": null, "improvement_rel": null, "win_kind": "fewer-attempt", "status": "discard", "description": "Attempted a 'fewer productions' win: when a join rule's inverse (partner) condition contributes NO variable to the head, every partner yields the same head atom, so emit a single head (first partner's achiever + min partner cost = byte-identical lp state) instead of one-per-partner. Detected statically per join firing. RESULT: grounder_atoms/pushes EXACTLY UNCHANGED (47644479/22398404) -> the collapse branch NEVER fired anywhere in the suite, and no trajectory moved. Reason: normal-form transformation (full_reducer/yannakakis semijoin reduction) already projects away non-propagating variables, so every join condition contributes to its head; the non-contributing case does not exist here. The added per-firing detection loop is pure overhead (single quiet sweep 28.1s vs ~26.7s). DISCARD by deterministic proof of zero benefit (no A/B needed). Lesson: the same-head-join 'fewer' lever is empty on this suite; semijoin reduction already did it.", "timestamp": 1782789371, "segment": 0}
{"run": "checkpoint", "commit": "221da57", "metric": 26.641, "samples": [28.324, 26.815, 26.575, 26.641, 26.625], "metrics": {"grounder_atoms": 47644479, "grounder_pushes": 22398404, "peak_mem_mb": 55}, "ab": {"baseline_commit": "f2ff317", "baseline_median": 52.930, "baseline_samples": [52.765, 52.885, 52.930, 52.966, 53.032]}, "confidence": 319.49, "improvement_rel": 0.4967, "win_kind": "cheaper", "status": "verification", "description": "CUMULATIVE CHECKPOINT after runs 2-5,8,9 (6 keeps). Contemporaneous A/B of current HEAD 221da57 vs the ORIGINAL baseline f2ff317 in one quiet window: baseline median 52.930s -> current 26.641s = 49.7% faster (~2x speedup), confidence 319x. grounder_atoms/pushes IDENTICAL to baseline (47644479/22398404) => every kept change is behaviour-preserving (same productions, same plans). peak_mem 68->55MB. All wins came from removing per-fact heap allocations (Arguments/Achievers/JoinHashKey inline small_vector) and skipping per-call hash-container rehashing (reserve reached_facts + reuse/pre-size join tables). Not a metric change; logged for the record.", "timestamp": 1782790406, "segment": 0}
{"run": 11, "commit": "221da57", "metric": 26.588, "samples": [26.708, 26.726, 26.588, 26.457, 26.480], "metrics": {"grounder_atoms": 47644479, "grounder_pushes": 22398404, "peak_mem_mb": 55}, "ab": {"head_commit": "221da57", "head_median": 26.505, "head_samples": [26.489, 26.726, 26.535, 26.466, 26.505]}, "confidence": 0.762, "improvement_rel": -0.0031, "win_kind": "cheaper", "status": "discard", "description": "Fuse the reached_facts find+insert into a single emplace probe in process_new_fact (halves the ~22.4M new-branch double-probes), with const_cast in-place cost mutation on the cheaper branch. Byte-identical: grounder_atoms/pushes FLAT, zero trajectory moves. But DISCARD: A/B vs HEAD 221da57 (26.505 median) gives candidate 26.588 = -0.3% (neutral/slightly worse). The saved probes are offset by the ~25.2M extra inline-Fact moves emplace does constructing+discarding a temp on every duplicate (53% of productions); the phmap SwissTable probe (compact control-byte scan) is too cheap for halving probe count to win this trade. Reverted. INSIGHT: operation-count reduction on the reached_facts probe is also tapped out -- the probe is already SwissTable-efficient.", "timestamp": 1782790979, "segment": 0}
{"run": 12, "commit": "221da57", "metric": 26.4905, "samples": [26.619, 26.239, 26.374, 26.331, 26.384, 26.554, 26.623, 26.499, 26.578, 26.482], "metrics": {"grounder_atoms": 47644479, "grounder_pushes": 22398404, "peak_mem_mb": 55}, "ab": {"head_commit": "221da57", "head_median": 26.638, "head_samples": [26.616, 26.694, 26.520, 26.769, 28.254, 26.628, 26.613, 26.644, 26.679, 26.632]}, "confidence": 1.318, "improvement_rel": 0.0055, "win_kind": "cheaper", "status": "discard", "description": "Reserve backchain_from_goal's local achieved_atoms set (phmap::flat_hash_set<int>) to the previous backchain's size (new Datalog member backchain_reserve_hint), same pattern as run 8. Byte-identical (counters FLAT). But DISCARD: pooled 10+10 A/B vs HEAD 221da57 gives 0.55% (below 1.91% noise floor), confidence 1.32x and falling. Backchain only visits the relaxed-plan subset (much smaller than the 47.6M grounding productions), so reserving its set is within noise. Its main per-atom allocation (GroundAtom = std::vector<int> in add_useful_atom) can't be inlined -- GroundAtom is a core type used in 107 sites across states/novelty/successor-gen, far out of grounder scope. Reverted. This exhausts the reserve targets: reached_facts (run8 KEEP) + join tables (run9 KEEP) were the hot ones; backchain/initial_facts/EDB are too light.", "timestamp": 1782792133, "segment": 0}
{"run": 13, "commit": "359d50e", "metric": 26.318, "samples": [26.455, 26.371, 26.210, 26.302, 26.318], "metrics": {"grounder_atoms": 47644479, "grounder_pushes": 22398404, "peak_mem_mb": 51}, "ab": {"head_commit": "221da57", "head_median": 26.718, "head_samples": [26.786, 26.718, 26.599, 26.608, 26.774]}, "confidence": 4.35, "improvement_rel": 0.0150, "win_kind": "cheaper", "status": "keep", "description": "JoinHashTable::get_entries looked up partners with operator[] (hash_table[key]), which INSERTS an empty JoinHashEntry whenever the key has no partner yet -- which is the common case while a join is still filling and permanent for one-sided keys. That polluted both join maps with empty entries (extra inserts + rehashing + larger maps + larger run-9 reserve). Switched to find() returning a static empty JoinHashEntry on miss: byte-identical (a missing key == an empty entry == no partners), grounder_atoms/pushes FLAT, 62/62 checks pass. peak_mem 55->51MB confirms the pollution was real. Win is 'cheaper'. Contemporaneous A/B vs fresh HEAD 221da57 (26.718 median): KEEP, confidence 4.35x, 1.5%.", "timestamp": 1782792815, "segment": 0}
{"run": 14, "commit": "4a42d75", "metric": 23.674, "samples": [23.917, 23.674, 23.591, 23.762, 23.658], "metrics": {"grounder_atoms": 47644479, "grounder_pushes": 22398404, "peak_mem_mb": 51}, "ab": {"head_commit": "359d50e", "head_median": 26.396, "head_samples": [26.434, 26.316, 26.425, 26.298, 26.396]}, "confidence": 31.12, "improvement_rel": 0.1031, "win_kind": "cheaper", "status": "keep", "description": "MapVariablePosition (body-var -> head-position map, consulted once per body argument per produced head in project/join/product) used std::unordered_map<Term,int> (node-based, pointer-chasing) AND get_head_position_of_arg did TWO lookups (has_variable=count then at). Switched the map to phmap::flat_hash_map (SwissTable, cache-friendly) and added position_of() doing a SINGLE find. Tens of millions of calls in the hot loops. Byte-identical (same mapping) -> grounder_atoms/pushes FLAT, 62/62 checks pass. Win is 'cheaper'. Contemporaneous A/B vs fresh HEAD 359d50e (26.396 median): KEEP, confidence 31x, 10.3%. NB: a std::unordered_map on the hot path was a hidden bottleneck the allocation work had masked.", "timestamp": 1782793406, "segment": 0}
{"run": 15, "commit": "592b0bc", "metric": 22.584, "samples": [22.584, 22.582, 22.869, 22.540, 22.626], "metrics": {"grounder_atoms": 47644479, "grounder_pushes": 22398404, "peak_mem_mb": 51}, "ab": {"head_commit": "4a42d75", "head_median": 23.786, "head_samples": [23.825, 23.769, 23.825, 23.774, 23.786]}, "confidence": 28.95, "improvement_rel": 0.0505, "win_kind": "cheaper", "status": "keep", "description": "Precompute per (rule,condition) the head position of each argument (object/non-head folded to -1), lazily cached in RuleBase::condition_head_positions. The join position-fill and partner-fill inner loops now index this array instead of calling get_head_position_of_arg (a variable_position hash lookup) per argument per produced head -- tens of millions of lookups removed, replaced by branch+indexed write. Byte-identical (head_pos[i]!=-1 == old pos!=-1 && !is_object) -> grounder_atoms/pushes FLAT, 62/62 checks pass. Win is 'cheaper'. Contemporaneous A/B vs fresh HEAD 4a42d75 (23.786 median): KEEP, confidence 29x, 5.1%. (project keeps get_head_position_of_arg: it also does a constant-match check on object args.)", "timestamp": 1782794050, "segment": 0}
{"run": 16, "commit": "e7b30a7", "metric": 22.545, "samples": [22.586, 22.603, 22.536, 22.438, 22.545], "metrics": {"grounder_atoms": 47644479, "grounder_pushes": 22398404, "peak_mem_mb": 51}, "ab": {"head_commit": "592b0bc", "head_median": 22.631, "head_samples": [22.656, 22.631, 22.623, 22.652, 22.591]}, "confidence": 2.52, "improvement_rel": 0.0038, "win_kind": "cheaper", "status": "keep", "description": "VariableSource had a const get_table() that returned the table BY VALUE (a full std::vector<pair<int,int>> copy). backchain's get_instantiation_of_variable does variable_table.get_table()[idx] per variable per useful atom (recursively), copying the whole table just to read one entry, and extract_variable_instantiation does get_table().size(). Changed the const overload to return const&. Byte-identical results -> grounder_atoms/pushes FLAT, 62/62 checks pass. Small win (backchain is light) but confirmable: tight A/B vs HEAD 592b0bc (22.631 median) -> KEEP, confidence 2.52x, 0.4%. Strictly-better code (no copy).", "timestamp": 1782794562, "segment": 0}
{"run": 17, "commit": "ac968eb", "metric": 22.505, "samples": [22.505, 22.385, 22.564, 22.496, 22.761], "metrics": {"grounder_atoms": 47644479, "grounder_pushes": 22398404, "peak_mem_mb": 51}, "ab": {"head_commit": "e7b30a7", "head_median": 22.649, "head_samples": [22.649, 22.656, 22.631, 22.705, 22.611]}, "confidence": 3.47, "improvement_rel": 0.0064, "win_kind": "cheaper", "status": "keep", "description": "Reuse run-15's precomputed condition head positions in the project rule's loop too: non-object args index head_positions[i] instead of calling get_head_position_of_arg; object args keep their inline constant-match check. Byte-identical (counters FLAT, 62/62 checks pass). Small (project is less hot than join in this suite) but confirmable: A/B vs HEAD e7b30a7 (22.649 median) -> KEEP, confidence 3.47x, 0.6%.", "timestamp": 1782795100, "segment": 0}
